{
  "artifact_id": "tiber-fantasy-pclr-20260812-tunsil-jacory-croskey-merritt-r1",
  "blob_digest": "sha256:2d20f7235006dd210e2b08262cedd7a13c0438750377691a48745fe527be3bb6",
  "commit": "3750bac99aaea6ab52a1f53dc5ed7a171e442fda",
  "governance_status": "promoted",
  "path": "data/post-cutoff-ledger/records/pclr_20260812_tunsil_jacory_croskey_merritt_r1.json",
  "repository": "Prometheus-Frameworks/TIBER-Fantasy",
  "schema_version": "research-governing-manifest/v1"
}
