{
  "artifact_id": "tiber-fantasy-pclr-20260812-tunsil-terry-mclaurin-r1",
  "blob_digest": "sha256:4a74c7ba3437e788debabea223b2031f677b230f5fbd0c9f37c2dd8df494eaba",
  "commit": "3750bac99aaea6ab52a1f53dc5ed7a171e442fda",
  "governance_status": "promoted",
  "path": "data/post-cutoff-ledger/records/pclr_20260812_tunsil_terry_mclaurin_r1.json",
  "repository": "Prometheus-Frameworks/TIBER-Fantasy",
  "schema_version": "research-governing-manifest/v1"
}
