{
  "artifact_id": "tiber-fantasy-pclr-20260812-tunsil-rachaad-white-r1",
  "blob_digest": "sha256:08b8ee8d3698e173712955ed5b1411548bfa10de64070349df460a14addd6910",
  "commit": "3750bac99aaea6ab52a1f53dc5ed7a171e442fda",
  "governance_status": "promoted",
  "path": "data/post-cutoff-ledger/records/pclr_20260812_tunsil_rachaad_white_r1.json",
  "repository": "Prometheus-Frameworks/TIBER-Fantasy",
  "schema_version": "research-governing-manifest/v1"
}
